{
  "schema_version": 1,
  "plan_id": "mobile-echo-demo",
  "name": "Echo Demo",
  "steps": [
    {
      "step_id": "echo-1",
      "capability_id": "app.memory.write.mock",
      "description": "Write mock echo payload.",
      "mock": true,
      "inputs": { "text": "hello mobile" },
      "expected_outputs": { "stored": true }
    },
    {
      "step_id": "echo-2",
      "capability_id": "app.memory.retrieve.mock",
      "description": "Read mock echo payload.",
      "mock": true,
      "inputs": { "key": "last" },
      "expected_outputs": { "text": "hello mobile" }
    }
  ],
  "requires_network": false,
  "requires_background": false
}
